{
  "$schema": "https://json-schema.org/draft/2020-12/schema",
  "$id": "https://agenc.ag/schemas/relay/evidence-manifest.json",
  "title": "AgenC Relay Evidence Manifest",
  "type": "object",
  "additionalProperties": false,
  "required": [
    "schema_version",
    "manifest_id",
    "source_commit",
    "source_sha256",
    "lock_sha256",
    "entries"
  ],
  "properties": {
    "schema_version": { "enum": [1, 2] },
    "manifest_id": {
      "type": "string",
      "pattern": "^EVID-MANIFEST-[A-Z0-9][A-Z0-9_-]{0,63}$"
    },
    "source_commit": {
      "type": "string",
      "pattern": "^[0-9a-f]{40}$"
    },
    "source_sha256": { "$ref": "#/$defs/sha256" },
    "lock_sha256": { "$ref": "#/$defs/sha256" },
    "entries": {
      "type": "array",
      "minItems": 1
    }
  },
  "allOf": [
    {
      "if": {
        "properties": { "schema_version": { "const": 1 } },
        "required": ["schema_version"]
      },
      "then": {
        "properties": {
          "entries": { "items": { "$ref": "#/$defs/evidence-v1" } }
        }
      }
    },
    {
      "if": {
        "properties": { "schema_version": { "const": 2 } },
        "required": ["schema_version"]
      },
      "then": {
        "properties": {
          "entries": { "items": { "$ref": "#/$defs/evidence-v2" } }
        }
      }
    }
  ],
  "$defs": {
    "sha256": {
      "type": "string",
      "pattern": "^[0-9a-f]{64}$"
    },
    "timestamp": {
      "type": "string",
      "format": "date-time",
      "pattern": "^\\d{4}-\\d{2}-\\d{2}T\\d{2}:\\d{2}:\\d{2}(?:\\.\\d{1,9})?Z$"
    },
    "toolchain": {
      "type": "array",
      "minItems": 1,
      "maxItems": 32,
      "items": {
        "type": "object",
        "additionalProperties": false,
        "required": ["name", "argv", "version"],
        "properties": {
          "name": {
            "type": "string",
            "pattern": "^[a-z0-9][a-z0-9-]{0,63}$"
          },
          "argv": {
            "type": "array",
            "minItems": 1,
            "maxItems": 32,
            "items": { "type": "string", "minLength": 1, "maxLength": 512 }
          },
          "version": { "type": "string", "minLength": 1, "maxLength": 512 }
        }
      }
    },
    "evidence-common": {
      "type": "object",
      "required": [
        "evidence_id",
        "claim_ids",
        "command",
        "tool",
        "source_commit",
        "source_sha256",
        "lock_sha256",
        "target",
        "features",
        "started_at",
        "ended_at",
        "result",
        "artifact",
        "limitations"
      ],
      "properties": {
        "evidence_id": {
          "type": "string",
          "pattern": "^EVID-[A-Z0-9][A-Z0-9_-]{2,127}$"
        },
        "claim_ids": {
          "type": "array",
          "minItems": 1,
          "uniqueItems": true,
          "items": {
            "type": "string",
            "pattern": "^(?:S\\d{2}-(?:\\d{3}|900)|(?:ARCH|E2EE)-[A-Z0-9-]+)$"
          }
        },
        "command": { "type": "string", "minLength": 1, "maxLength": 4096 },
        "tool": {
          "type": "object",
          "additionalProperties": false,
          "required": ["name", "version"],
          "properties": {
            "name": { "type": "string", "minLength": 1, "maxLength": 128 },
            "version": { "type": "string", "minLength": 1, "maxLength": 256 }
          }
        },
        "source_commit": {
          "type": "string",
          "pattern": "^[0-9a-f]{40}$"
        },
        "source_sha256": { "$ref": "#/$defs/sha256" },
        "lock_sha256": { "$ref": "#/$defs/sha256" },
        "target": {
          "type": "string",
          "pattern": "^[a-z0-9_]+-[a-z0-9_]+-[a-z0-9_.-]+$"
        },
        "features": {
          "type": "array",
          "uniqueItems": true,
          "items": {
            "type": "string",
            "pattern": "^[A-Za-z0-9_+.-]{1,128}$"
          }
        },
        "started_at": { "$ref": "#/$defs/timestamp" },
        "ended_at": { "$ref": "#/$defs/timestamp" },
        "result": { "enum": ["passed", "failed", "not-run"] },
        "artifact": {
          "type": "object",
          "additionalProperties": false,
          "required": ["label", "sha256"],
          "properties": {
            "label": { "type": "string", "minLength": 1, "maxLength": 256 },
            "sha256": { "$ref": "#/$defs/sha256" },
            "path": {
              "type": "string",
              "pattern": "^conformance/evidence/artifacts/[A-Za-z0-9][A-Za-z0-9_./-]{0,511}$"
            }
          }
        },
        "limitations": {
          "type": "array",
          "maxItems": 64,
          "uniqueItems": true,
          "items": { "type": "string", "minLength": 1, "maxLength": 2048 }
        }
      }
    },
    "evidence-v1": {
      "allOf": [{ "$ref": "#/$defs/evidence-common" }],
      "unevaluatedProperties": false
    },
    "evidence-v2-extension": {
      "type": "object",
      "required": ["toolchain_policy_sha256", "toolchain"],
      "properties": {
        "toolchain_policy_sha256": { "$ref": "#/$defs/sha256" },
        "toolchain": { "$ref": "#/$defs/toolchain" },
        "limitations": { "minItems": 1 }
      }
    },
    "evidence-v2": {
      "allOf": [
        { "$ref": "#/$defs/evidence-common" },
        { "$ref": "#/$defs/evidence-v2-extension" }
      ],
      "unevaluatedProperties": false
    }
  }
}
